name,url,description,test_type,duration,remote_testing,adaptive
Account Manager Solution,https://www.shl.com/products/product-catalog/view/account-manager-solution/,"The Account Manager solution is an assessment used for job candidates applying to mid-level leadership positions that tend to manage the day-to-day operations and activities of client accounts. Sample tasks for these jobs include, but are not limited to: communicating with clients about project status, developing and maintaining project plans, coordinating internally with appropriate project personnel, and ensuring client expectations are being met. Potential job titles that use this solution ar","['Competencies', 'Personality & Behavior', 'Ability & Aptitude', 'Biodata & Situational Judgement']",2,No,No
Administrative Professional - Short Form,https://www.shl.com/products/product-catalog/view/administrative-professional-short-form/,"The Administrative Professional solution is for entry to mid-level positions that involve routine clerical and administrative functions in addition to office management functions and customer service. Sample tasks for this job include, but are not limited to: arranging conference calls; drafting correspondence; scheduling meetings; greeting visitors; coordinating office activities. Potential job titles that use this solution are: Administrative Assistant, Secretary, Office Manager, Administrativ","['Ability & Aptitude', 'Knowledge & Skills', 'Personality & Behavior']",2,No,No
Agency Manager Solution,https://www.shl.com/products/product-catalog/view/agency-manager-solution/,"The Agency Manager solution is for mid-level sales management positions that include front line management and sales responsibilities. Sample tasks for this job include, but are not limited to: directing and coordinating financial activities of workers in a branch, office, or department of an establishment, such as branch bank, brokerage firm, risk and insurance department, or credit department.  Potential job titles that use this solution are: Agency Manager, Brokerage Manager. Multiple configu","['Ability & Aptitude', 'Biodata & Situational Judgement', 'Personality & Behavior', 'Simulations']",2,No,No
Apprentice + 8.0 Job Focused Assessment,https://www.shl.com/products/product-catalog/view/apprentice-8-0-job-focused-assessment-4261/,"The Apprentice + 8.0 Job-Focused Assessment is a short, targeted, globally applicable assessment which includes a short cognitive ability measure. This assessment is designed for entry-level positions appropriate for countries and industries that use an apprenticeship model. It is intended to be used multi-nationally for organisations whose business spans across regions. General Population, Graduate, Entry-Level, English International, German,","['Biodata & Situational Judgement', 'Personality & Behavior']",2,No,No
Apprentice 8.0 Job Focused Assessment,https://www.shl.com/products/product-catalog/view/apprentice-8-0-job-focused-assessment/,"The Apprentice 8.0 Job-Focused Assessment is a short, targeted, globally applicable assessment. This assessment is designed for entry-level positions appropriate for countries and industries that use an apprenticeship model. It is intended to be used multi-nationally for organizations whose business spans across regions. Entry-Level, General Population, Graduate, English International, German, French,","['Biodata & Situational Judgement', 'Personality & Behavior']",2,No,No
Bank Administrative Assistant - Short Form,https://www.shl.com/products/product-catalog/view/bank-administrative-assistant-short-form/,"The Administrative Assistant solution is for entry-level clerical positions that interact with external or internal customers. Sample tasks for these jobs include, but are not limited to: answering telephones, managing files and records, sorting mail, greeting customers, and collaborating with co-workers on projects. Potential job titles that use this solution are: Receptionist and Administrative Assistant. There are multiple configurations of this solution available. Entry-Level, English (USA),","['Ability & Aptitude', 'Biodata & Situational Judgement', 'Knowledge & Skills', 'Personality & Behavior']",2,No,No
Bank Collections Agent - Short Form,https://www.shl.com/products/product-catalog/view/bank-collections-agent-short-form/,"This solution is for entry-level collections positions in an inbound or outbound call center environment in a financial setting. Candidates answer multiple choice questions to measure achievement orientation, dependability, collector numerical skills, revenue recovery, customer focus, and persistence and planfulness. There are multiple configurations and versions of this solution available. Entry-Level, English (USA),","['Ability & Aptitude', 'Biodata & Situational Judgement', 'Personality & Behavior']",2,No,No
Bank Operations Supervisor - Short Form,https://www.shl.com/products/product-catalog/view/bank-operations-supervisor-short-form/,"The Bank Operations Supervisor solution is for job candidates applying to entry-level leadership positions who tend to supervise hourly employees. Sample tasks for these jobs include, but are not limited to:  planning and preparing work schedules, assigning employees to specific duties; coaching  employees on attendance, conduct, schedule adherence, and work tasks, developing employees' skills ; training subordinates; prioritizing multiple tasks  and priorities; and making  day-to-day decisions ","['Ability & Aptitude', 'Biodata & Situational Judgement', 'Personality & Behavior', 'Simulations']",2,No,No
Bilingual Spanish Reservation Agent Solution,https://www.shl.com/products/product-catalog/view/bilingual-spanish-reservation-agent-solution/,"The Bilingual Reservation Agent solution is designed for customer centered entry-level positions within the hospitality industry. Sample tasks may include making, updating, or canceling hotel reservations made in English or Spanish; listening to customers speak Spanish and entering information into a computer in English; providing information on the hotel and the services offered. Potential job titles that use this solution are: Bilingual Reservation Agent, Customer Service Representative and Re","['Biodata & Situational Judgement', 'Personality & Behavior', 'Simulations', 'Ability & Aptitude']",2,No,No
"Bookkeeping, Accounting, Auditing Clerk Short Form",https://www.shl.com/products/product-catalog/view/bookkeeping-accounting-auditing-clerk-short-form/,"The Bookkeeping, Accounting, and Auditing Clerk solution is for entry-level positions that involve entering numerical data into computer systems and maintaining financial records. Sample tasks for this job include, but are not limited to: entering financial data into computers; checking financial records for accuracy; perform routine computations on financial data. Potential job titles that use this solution are: Accounting Clerk, Bookkeeper, Accounting Associate, Auditing Clerk and Accounts Rec","['Personality & Behavior', 'Simulations', 'Knowledge & Skills', 'Biodata & Situational Judgement', 'Ability & Aptitude']",2,No,No
Branch Manager - Short Form,https://www.shl.com/products/product-catalog/view/branch-manager-short-form/,"This solution is for mid to upper-level financial institution managerial positions. Candidates answer a series of multiple choice questions to measure management potential, management judgment, leadership potential, team management, branch manager problem solving, business leadership, leadership motivation, interpersonal leadership, self leadership, and branch manager judgment. There are multiple configurations and versions of this solution available. Front Line Manager, Manager, Supervisor, Eng","['Ability & Aptitude', 'Biodata & Situational Judgement', 'Personality & Behavior']",2,No,No
Cashier Solution,https://www.shl.com/products/product-catalog/view/cashier-solution/,"The Cashier solution is for entry-level retail positions in which employees receive payment in the form of cash, check, or credit cards for goods purchased. Sample tasks for these jobs include, but are not limited to: handling payments, offering customer service, and issuing receipts and refunds. Potential job titles that use this solution are: Cashier, Sales Associate, and Clerk. There are multiple configurations and versions of this solution available. Entry-Level, English (USA),","['Biodata & Situational Judgement', 'Ability & Aptitude', 'Personality & Behavior']",2,No,No
Adobe Experience Manager (New),https://www.shl.com/products/product-catalog/view/adobe-experience-manager-new/,"Multi-choice test that measures the knowledge of AEM components, templates, workflows, AEM collections, OSGi services and troubleshooting of AEM projects. Mid-Professional, Professional Individual Contributor, English (USA),",['Knowledge & Skills'],2,No,No
Adobe Photoshop CC,https://www.shl.com/products/product-catalog/view/adobe-photoshop-cc/,"The Adobe Photoshop CC test measures knowledge of Adobe Photoshop CC. Designed for experienced users, this test covers the following topics: 3D, Color, File Management, Interface, Layers, Painting and Drawing, Retouch and Enhancements, Selection, Text, and Web. Mid-Professional, Professional Individual Contributor, English (USA),",['Knowledge & Skills'],2,No,No
Aeronautical Engineering (New),https://www.shl.com/products/product-catalog/view/aeronautical-engineering-new/,"Multi-choice test that measures the knowledge of flight mechanics, space dynamics, aerodynamics, structures and propulsion. Graduate, Mid-Professional, Professional Individual Contributor, English (USA),",['Knowledge & Skills'],2,No,No
Aerospace Engineering (New),https://www.shl.com/products/product-catalog/view/aerospace-engineering-new/,"Multi-choice test that measures the conceptual knowledge of aerodynamics, aircraft systems and instrumentation, flight dynamics, space dynamics and avionics. Graduate, Mid-Professional, Professional Individual Contributor, English (USA),",['Knowledge & Skills'],2,No,No
Agile Software Development,https://www.shl.com/products/product-catalog/view/agile-software-development/,"Multi-choice test that measures the knowledge of agile methodology, scrum, feature driven software development, incremental and iterative development and processes involved in agile software development. Graduate, English (USA),",['Knowledge & Skills'],7,No,No
Agile Testing (New),https://www.shl.com/products/product-catalog/view/agile-testing-new/,"Multi-choice test that measures the knowledge of tools, techniques and processes involved in the Agile testing methodology. Mid-Professional, Professional Individual Contributor, English (USA),",['Knowledge & Skills'],2,No,No
AI Skills,https://www.shl.com/products/product-catalog/view/ai-skills/,"The AI Skills assessment measures the skills that help candidates successfully leverage AI in their work. General Population, English (USA),",['Personality & Behavior'],2,No,No
Amazon Web Services (AWS) Development (New),https://www.shl.com/products/product-catalog/view/amazon-web-services-aws-development-new/,"Multi-choice test that measures the knowledge of AWS delivery process, monitoring, metrics, logging, security, validation and scalability. Mid-Professional, Professional Individual Contributor, English (USA),",['Knowledge & Skills'],2,No,No
Android Development (New),https://www.shl.com/products/product-catalog/view/android-development-new/,"Multi-choice test that measures the knowledge of UI components for an Android device, services and alerts, animation and media apps, application components, security and testing. Mid-Professional, Professional Individual Contributor, English (USA),",['Knowledge & Skills'],2,No,No
Angular 6 (New),https://www.shl.com/products/product-catalog/view/angular-6-new/,"Multi-choice test that measures the knowledge of the basic components and modules of Angular 6 and concepts like data binding, dependency injection, CRUD with HTTP, typescript, routing and navigation. Mid-Professional, Professional Individual Contributor, English (USA),",['Knowledge & Skills'],2,No,No
AngularJS (New),https://www.shl.com/products/product-catalog/view/angularjs-new/,"Multi-choice test that measures the knowledge of AngularJS architecture, forms, directives, filters, controllers, routing and testing. Mid-Professional, Professional Individual Contributor, English (USA),",['Knowledge & Skills'],2,No,No
Apache Hadoop (New),https://www.shl.com/products/product-catalog/view/apache-hadoop-new/,"Multi-choice test that measures the knowledge of basic concepts of Hadoop, commands, HDFS and MapReduce. Mid-Professional, Professional Individual Contributor, English (USA),",['Knowledge & Skills'],2,No,No
Apache Hadoop Extensions (New),https://www.shl.com/products/product-catalog/view/apache-hadoop-extensions-new/,"Multi-choice test that measures the conceptual knowledge of Pig, Hive and HBase. Mid-Professional, Professional Individual Contributor, English (USA),",['Knowledge & Skills'],2,No,No
Apache HBase (New),https://www.shl.com/products/product-catalog/view/apache-hbase-new/,"Multi-choice test that measures the knowledge of HBase concepts such as CAP theorem, ACID properties, HBase client API, MapReduce integration, configuration and administration. Mid-Professional, Professional Individual Contributor, English (USA),",['Knowledge & Skills'],2,No,No
Apache Hive (New),https://www.shl.com/products/product-catalog/view/apache-hive-new/,"Multi-choice test that measures the knowledge of Hive architecture, datatypes, built-in functions, configurations, partitioning, bucketing and commands of Hive query language. Mid-Professional, Professional Individual Contributor, English (USA),",['Knowledge & Skills'],2,No,No
Apache Kafka (New),https://www.shl.com/products/product-catalog/view/apache-kafka-new/,"Multi-choice test that measures the knowledge of Apache Kafka architecture, components, clusters, performance tuning and advanced operations. Mid-Professional, Professional Individual Contributor, English (USA),",['Knowledge & Skills'],2,No,No
Apache Pig (New),https://www.shl.com/products/product-catalog/view/apache-pig-new/,"Multi-choice test that measures the knowledge of Pig architecture, built-in operators, built-in functions and commands in PigLatin. Mid-Professional, Professional Individual Contributor, English (USA),",['Knowledge & Skills'],2,No,No
Apache Spark (New),https://www.shl.com/products/product-catalog/view/apache-spark-new/,"Multi-choice test that measures the knowledge of Apache Spark principles, RDD operations - actions and transformations, lineage graphs and lazy evaluation. Mid-Professional, Professional Individual Contributor, English (USA),",['Knowledge & Skills'],2,No,No
ASP .NET with C# (New),https://www.shl.com/products/product-catalog/view/asp-net-with-c-new/,"Multi-choice test that measures the knowledge of .NET framework and controls, C# fundamentals, OOPs concepts and advanced topics such as data access components, state management and security services. Mid-Professional, Professional Individual Contributor, English (USA),",['Knowledge & Skills'],2,No,No
ASP.NET 4.5,https://www.shl.com/products/product-catalog/view/asp-net-4-5/,"The ASP.NET 4.5 test measures knowledge of programming in the ASP.NET environment. Designed for experienced developers, but an average performer in this role should pass this test. This test includes the following topics: .NET Framework, Client-Side Programming, Data Access, Enhanced Runtime Features, Portals, Services and Mobile, Security, Troubleshooting and Optimization, Web Applications, and Web Forms. Mid-Professional, Professional Individual Contributor, English (USA),",['Knowledge & Skills'],2,No,No
Assessment and Development Center Exercises,https://www.shl.com/products/product-catalog/view/assessment-and-development-center-exercises/,"SHL offers a comprehensive range of Assessment and Development Centre exercise in digital format, for remote assessment through our Virtual Assessment and Development Centre platform.We offer a wide range of exercise types including group exercise, role plays, analysis presentations and written exercises.Exercises are available across a wide range of job levels and industry contexts.Contact SHL to find out more. Director, Entry-Level, Executive, Front Line Manager, General Population, Graduate, ",['Assessment Exercises'],2,No,No
Automata - Fix (New),https://www.shl.com/products/product-catalog/view/automata-fix-new/,"A simulated compiler integrated test to measure debugging skills in C, C++ and Java. The test checks the ability to fix logical or syntactical errors and to reuse an existing code.Your use of this assessment product may be subject to New York City Law 144 (Regulation of the Use of Automated Employment Decision Tools) (dated July 5, 2023). Compliance with Law 144 is your responsibility.
Read more on https://www.shl.com/legal/shl-us-regulatory-compliance/ Mid-Professional, English (USA),",['Simulations'],2,No,No
Automata - SQL (New),https://www.shl.com/products/product-catalog/view/automata-sql-new/,"A simulated query writing test that measures the ability to write SQL queries to perform DDL, DML and DCL tasks. Mid-Professional, Professional Individual Contributor, English (USA),",['Simulations'],2,No,No
Automata (New),https://www.shl.com/products/product-catalog/view/automata-new/,"An AI-powered coding simulation assessment that evaluates candidate’s programming ability. Offers a familiar IDE environment available in over 40 different programming languages and tests candidates using real-world coding problems.Your use of this assessment product may be subject to New York City Law 144 (Regulation of the Use of Automated Employment Decision Tools) (dated July 5, 2023). Compliance with Law 144 is your responsibility.
Read more on https://www.shl.com/legal/shl-us-regulatory-co",['Simulations'],2,No,No
Automata Data Science (New),https://www.shl.com/products/product-catalog/view/automata-data-science-new/,"A simulated test that measures the ability to analyze and modify data using machine learning algorithms to obtain desirable results. Mid-Professional, Professional Individual Contributor, English (USA),",['Simulations'],2,No,No
Automata Data Science Pro (New),https://www.shl.com/products/product-catalog/view/automata-data-science-pro-new/,"A simulated test that measures the ability to analyze and modify data using machine learning algorithms to obtain desirable results. Professional Individual Contributor, Mid-Professional, English (USA),",['Simulations'],2,No,No
Automata Front End,https://www.shl.com/products/product-catalog/view/automata-front-end/,"Simulation based test that measures the front-end development capabilities using HTML, CSS, and
JavaScript. The candidate is provided with 3 different sections to code in HTML, CSS and JavaScript respectively and a separate output section to view the output. This simulation is then manually scored. Entry-Level, Graduate, Mid-Professional, Professional Individual Contributor, Manager, English (USA),",['Simulations'],30,No,No
Automata Pro (New),https://www.shl.com/products/product-catalog/view/automata-pro-new/,"An AI-powered coding simulation assessment that evaluates candidate’s programming ability. Offers a familiar IDE environment available in over 40 different programming languages and tests candidates using real-world coding problems.Your use of this assessment product may be subject to New York City Law 144 (Regulation of the Use of Automated Employment Decision Tools) (dated July 5, 2023). Compliance with Law 144 is your responsibility.
Read more on https://www.shl.com/legal/shl-us-regulatory-co",['Simulations'],2,No,No
Automata Selenium,https://www.shl.com/products/product-catalog/view/automata-selenium/,"A coding simulation assessment that evaluates the ability to conduct tasks related to automation testing using Selenium scripts. Entry-Level, Graduate, Manager, Mid-Professional, Professional Individual Contributor, English (USA),",['Simulations'],2,No,No
Automation Anywhere RPA Development (New),https://www.shl.com/products/product-catalog/view/automation-anywhere-rpa-development-new/,"Multi-choice test that measures the knowledge of Automation Anywhere dash board and task editor, control room, key commands, bots and Automation Anywhere client. Mid-Professional, Professional Individual Contributor, English (USA),",['Knowledge & Skills'],2,No,No
Automotive Engineering (New),https://www.shl.com/products/product-catalog/view/automotive-engineering-new/,"Multi-choice test that measures the knowledge of auto engine classification, engine fuel system, auto-vehicle technology, maintenance, inspection and troubleshooting. Graduate, Mid-Professional, Professional Individual Contributor, English (USA),",['Knowledge & Skills'],2,No,No
Basic Biology (New),https://www.shl.com/products/product-catalog/view/basic-biology-new/,"Multi choice test that measures the candidate's basic understanding of Biology. Professional Individual Contributor, Graduate, Mid-Professional, English (USA),",['Knowledge & Skills'],2,No,No
Basic Computer Literacy (Windows 10) (New),https://www.shl.com/products/product-catalog/view/basic-computer-literacy-windows-10-new/,"The Basic Computer Literacy (Windows 10) simulation measures knowledge of general computer terminology, processes, and applications and the ability to perform certain operations in a simulated environment resembling the actual application. This simulation consists of both multiple choice and simulation-based questions, and includes the following topics: Application Software, Computer Terms, Internet and Email, Managing Files, Operating System, and Parts of the Computer. Entry-Level, English (USA","['Simulations', 'Knowledge & Skills']",2,No,No
Basic Statistics (New),https://www.shl.com/products/product-catalog/view/basic-statistics-new/,"Multi-choice test that measures the knowledge of statistical methods, exploratory analysis, basics of probability, standard distributions and statistical testing. Graduate, Mid-Professional, Professional Individual Contributor, English (USA),",['Knowledge & Skills'],2,No,No
Biochemistry (New),https://www.shl.com/products/product-catalog/view/biochemistry-new/,"Multi-choice test that measures the knowledge of various bio-molecules like amino acids, proteins, enzymes, carbohydrates, vitamins and nucleic acids, and concepts of bioenergetics and metabolism. Graduate, Mid-Professional, Professional Individual Contributor, English (USA),",['Knowledge & Skills'],2,No,No
Biotech Lab Techniques (New),https://www.shl.com/products/product-catalog/view/biotech-lab-techniques-new/,"Multi-choice test that measures the knowledge of biophysical techniques, bio-processing and separation techniques like chromatography and electrophoresis. Graduate, Professional Individual Contributor, Mid-Professional, English (USA),",['Knowledge & Skills'],2,No,No
BizTalk (New),https://www.shl.com/products/product-catalog/view/biztalk-new/,"Multi-choice test that measures the knowledge of BizTalk architecture, pipelines, adapters, business process techniques and BizTalk administration. Mid-Professional, Professional Individual Contributor, English (USA),",['Knowledge & Skills'],2,No,No
Business Communication (adaptive),https://www.shl.com/products/product-catalog/view/business-communication-adaptive/,"This is an adaptive test that measures knowledge of communicating in the workplace. It measures the skills necessary to communicate effectively with coworkers at all levels and with external business contacts. Designed for the average business worker, this test includes the following topics: Electronic Communication, Employment Communication, Listening, Meetings, Nonverbal Communication, Verbal Communication, and Written Communication. Entry-Level, Front Line Manager, Manager, Mid-Professional, ",['Knowledge & Skills'],2,No,No
Business Communications,https://www.shl.com/products/product-catalog/view/business-communications/,"This test measures the candidate's knowledge of communicating in the workplace.  It measures the skills necessary to communicate effectively with coworkers at all levels and with external business contacts. Designed for the average business worker, this test includes the following topics: Electronic Communication, Employment Communication, Listening, Meetings, Nonverbal Communication, Verbal Communication, and Written Communication. This version of the test is not adaptive. English (USA), Approx",['Knowledge & Skills'],2,No,No
C Programming (New),https://www.shl.com/products/product-catalog/view/c-programming-new/,"Multi-choice test that measures the knowledge of C programming basics, functions, arrays, composed data types, and advanced C concepts like SLF, file handling and dynamic memory. Mid-Professional, Professional Individual Contributor, English (USA),",['Knowledge & Skills'],2,No,No
C# Programming (New),https://www.shl.com/products/product-catalog/view/c-programming-new-4039/,,['Knowledge & Skills'],15,No,No
C++ Programming (New),https://www.shl.com/products/product-catalog/view/c-programming-new-4122/,"Multi-choice test that measures the knowledge of programming in the C++ language and the ability to use the C++ standard library to write code. Mid-Professional, Professional Individual Contributor, English (USA),",['Knowledge & Skills'],2,No,No
Cardiology and Diabetes Management (New),https://www.shl.com/products/product-catalog/view/cardiology-and-diabetes-management-new/,"Multi-choice test that measures the knowledge of how to control and manage cardiovascular diseases and diabetes, and understanding of the diagnostic tests used for them. Graduate, Mid-Professional, Professional Individual Contributor, English (USA),",['Knowledge & Skills'],2,No,No
