name,url,description,test_type,duration,remote_testing,adaptive
OPQ Manager Plus Report,https://www.shl.com/products/product-catalog/view/opq-manager-plus-report/,"This concise OPQ (Occupational Personality Questionnaire) report is designed for use with and by managers.  It uses clear succinct bullets and tables for ease of interpretation.  It provide simple comments on each of the personality traits.Please note this report is currently being updated on Talent Central as part of a reporting refresh project, and there may be visual differences when comparing Talent Central reports to ones generated on other assessment platforms. Differences are regarding th",['Personality & Behavior'],2,No,No
OPQ Manager Plus Report 2.0,https://www.shl.com/products/product-catalog/view/opq-manager-plus-report-2-0/,"This concise OPQ (Occupational Personality Questionnaire) report is designed for use with and by managers. It uses clear succinct bullets and tables for ease of interpretation. It provides simple comments on each of the personality traits. Supervisor, Executive, Front Line Manager, General Population, Graduate, Manager, Mid-Professional, Professional Individual Contributor, Director, Entry-Level, Test Type:P",['Personality & Behavior'],2,No,No
OPQ Maximising your Learning Report,https://www.shl.com/products/product-catalog/view/opq-maximising-your-learning-report/,"This OPQ (Occupational Personality Questionnaire) report is designed to help people get the most from their development.  It summarises the preferred approach to learning across four dimensions. Executive, Front Line Manager, General Population, Graduate, Manager, Mid-Professional, Professional Individual Contributor, Supervisor, Director, Danish, Dutch, Portuguese, Swedish, English International,",['Personality & Behavior'],2,No,No
OPQ MQ Sales Report,https://www.shl.com/products/product-catalog/view/opq-mq-sales-report/,"This OPQ (Occupational Personality Questionnaire) report provides a graphical and narrative summary of an individual's natural style that is critical to sales success. It can also, optionally, use input from the SHL Motivation Questionnaire (MQ) to add information about the sales motivators and drives of an individual. 
Note: updated versions of Turkish, Hungarian and Indonesian Sales Report were launched on 01 July 2013.Please note this report is currently being updated on Talent Central as par",['Personality & Behavior'],2,No,No
OPQ Premium Plus Report,https://www.shl.com/products/product-catalog/view/opq-premium-plus-report/,"This OPQ (Occupational Personality Questionnaire) report contains a selection of reports including OPQ profile, user report, manager plus report, candidate plus report, universal competency report, team impact selection report. Supervisor, Front Line Manager, General Population, Graduate, Manager, Mid-Professional, Professional Individual Contributor, Director, Executive, English International,",['Personality & Behavior'],2,No,No
OPQ Premium Plus Report 2.0,https://www.shl.com/products/product-catalog/view/opq-premium-plus-report-2-0/,"This OPQ (Occupational Personality Questionnaire) report contains a selection of reports including OPQ profile, user report, manager plus report, candidate plus report, universal competency report, team impact selection report. Manager, Graduate, Mid-Professional, Professional Individual Contributor, Director, General Population, Entry-Level, Executive, Front Line Manager, Supervisor, Test Type:P",['Personality & Behavior'],2,No,No
OPQ Profile Report,https://www.shl.com/products/product-catalog/view/opq-profile-report/,"This is a graphical profile charts presenting results across the 32 OPQ scales. It is designed to be interpreted by OPQ trained users only.Please note this report is currently being updated on Talent Central as part of a reporting refresh project, and there may be visual differences when comparing Talent Central reports to ones generated on other assessment platforms. Differences are regarding the layout and display of the reports only and do not affect the underlying scoring. When viewing sampl",['Personality & Behavior'],2,No,No
OPQ Team Impact Group Development Report,https://www.shl.com/products/product-catalog/view/opq-team-impact-group-development-report/,"These reports are based on the SHL Team Impact Model, which is focused on actual team processes.  They are supported by clear and easy to understand graphics which do not require OPQ training.“IMPORTANT! Please note that for a sample report contact Managed Services"". Executive, Director, Front Line Manager, General Population, Graduate, Manager, Mid-Professional, Professional Individual Contributor, Supervisor, Danish, English International, Finnish, Dutch, Norwegian, Swedish, English (USA),",['Personality & Behavior'],2,No,No
OPQ Team Impact Individual Development Report,https://www.shl.com/products/product-catalog/view/opq-team-impact-individual-development-report/,"These reports are based on the SHL Team Impact Model, which is focused on actual team processes.  They are supported by clear and easy to understand graphics which do not require OPQ training. Director, Executive, Front Line Manager, General Population, Graduate, Manager, Mid-Professional, Professional Individual Contributor, Supervisor, English International, Danish, Dutch, Finnish, Latin American Spanish, Norwegian, Swedish, English (USA),",['Personality & Behavior'],2,No,No
OPQ Team Impact Selection Report,https://www.shl.com/products/product-catalog/view/opq-team-impact-selection-report/,"These reports are based on the SHL Team Impact Model, which is focused on actual team processes.  They are supported by clear and easy to understand graphics which do not require OPQ training. Director, Executive, Front Line Manager, General Population, Graduate, Manager, Mid-Professional, Professional Individual Contributor, Supervisor, Danish, Dutch, Finnish, Latin American Spanish, Norwegian, Swedish, English International, English (USA),",['Personality & Behavior'],2,No,No
OPQ Team Types & Leadership Styles Profile,https://www.shl.com/products/product-catalog/view/opq-team-types-and-leadership-styles-profile/,"This OPQ (Occupational Personality Questionnaire) report is based on Belbin's team types and Bass's leadership and reporting styles.  Belbins team types: individual preferred role when working in ateam.  Bass's leadership and reporting styles: individuals preferred leadership styles and likely style of behaviour as a direct report. Director, Executive, Front Line Manager, General Population, Graduate, Manager, Mid-Professional, Professional Individual Contributor, Supervisor, Flemish, French (Be",['Personality & Behavior'],2,No,No
OPQ Team Types and Leadership Styles Report,https://www.shl.com/products/product-catalog/view/opq-team-types-and-leadership-styles-report/,"This OPQ (Occupational Personality Questionnaire) report is based on Belbin's team types and Bass's leadership and reporting styles.  Belbins team types: individual preferred role when working in ateam.  Bass's leadership and reporting styles: individuals preferred leadership styles and likely style of behaviour as a direct report. Director, Executive, Front Line Manager, General Population, Graduate, Manager, Mid-Professional, Professional Individual Contributor, Supervisor, Flemish, French (Be",['Personality & Behavior'],2,No,No
OPQ UCF Development Action Planner Report 1.0,https://www.shl.com/products/product-catalog/view/opq-ucf-development-action-planner-report/,"This OPQ (Occupational Personality Questionnaire) report provides clear and relevant information about an individual's strengths and areas for development, for use in staff development and on-boarding situations.Please note this report is currently being updated on Talent Central as part of a reporting refresh project, and there may be visual differences when comparing Talent Central reports to ones generated on other assessment platforms. Differences are regarding the layout and display of the ",['Personality & Behavior'],2,No,No
OPQ UCF Development Action Planner Report 2.0,https://www.shl.com/products/product-catalog/view/opq-ucf-development-action-planner-report-2-0/,"This OPQ (Occupational Personality Questionnaire) report provides clear and relevant information about an individual's strengths and areas for development, for use in staff development and on-boarding situations. Director, Executive, Front Line Manager, Manager, Graduate, General Population, Professional Individual Contributor, Supervisor, Mid-Professional, Test Type:P",['Personality & Behavior'],2,No,No
OPQ Universal Competency Report 1.0,https://www.shl.com/products/product-catalog/view/opq-universal-competency-report/,"This OPQ (Occupational Personality Questionnaire) report is based on the Universal Competency framework.  It graphically outlines how an individual's typical way of behaving is likely to impact on competencies.  It provides a graphical scale for each competency and summarises aspects of personality which contribute (positively or negatively) to each competency.Please note this report is currently being updated on Talent Central as part of a reporting refresh project, and there may be visual diff",['Personality & Behavior'],2,No,No
OPQ Universal Competency Report 2.0,https://www.shl.com/products/product-catalog/view/opq-universal-competency-report-2-0/,"This OPQ (Occupational Personality Questionnaire) report is based on the Universal Competency framework.  It graphically outlines how an individual's typical way of behaving is likely to impact on competencies.  It provides a graphical scale for each competency and summarises aspects of personality which contribute (positively or negatively) to each competency. Graduate, Manager, Mid-Professional, Professional Individual Contributor, Supervisor, Director, Executive, Front Line Manager, General P",['Personality & Behavior'],2,No,No
OPQ User and Managers Report,https://www.shl.com/products/product-catalog/view/opq-user-and-managers-report/,"This OPQ (Occupational Personality Questionnaire) report consists of two reports. The User Report includes a Profile Chart and narrative text, focusing on an individuals likely way of behaving at work.  The Manager's Report describes the individual's personal style in narrative text that can be given directly to a line manager.
These reports can be used as an interpretation aid when giving feedback, writing reports, or interpreting OPQ information. Director, Executive, Front Line Manager, Genera",['Personality & Behavior'],2,No,No
OPQ User Report,https://www.shl.com/products/product-catalog/view/opq-user-report/,"This OPQ (Occupational Personality Questionnaire) report includes a Profile Chart and narrative text, focusing on an individuals likely way of behaving at work.  It can be used as an interpretation aid when giving feedback, writing reports, or interpreting OPQ information. Director, Executive, Front Line Manager, General Population, Graduate, Manager, Mid-Professional, Professional Individual Contributor, Supervisor, Flemish, French (Belgium), Spanish, Danish, Dutch, Finnish, French, German, Ita","['Personality & Behavior', 'Simulations']",2,No,No
Oracle DBA (Advanced Level) (New),https://www.shl.com/products/product-catalog/view/oracle-dba-advanced-level-new/,"Multi-choice test that measures the knowledge of Oracle DB architecture, backup and recovery, MySQL administration and advanced topics such as network configuration and data warehouse management. Mid-Professional, Professional Individual Contributor, English (USA),",['Knowledge & Skills'],2,No,No
Oracle DBA (Entry Level) (New),https://www.shl.com/products/product-catalog/view/oracle-dba-entry-level-new/,"Multi-choice test that measures the knowledge of Oracle database architecture, data management, backup and recovery, and MySQL administration. Mid-Professional, Professional Individual Contributor, English (USA),",['Knowledge & Skills'],2,No,No
Oracle PL/SQL (New),https://www.shl.com/products/product-catalog/view/oracle-plsql-new/,"Multi-choice test that measures the knowledge of SQL queries, relational database concepts and specific Oracle PL/SQL features. Mid-Professional, Professional Individual Contributor, English (USA),",['Knowledge & Skills'],2,No,No
Oracle WebLogic Server (New),https://www.shl.com/products/product-catalog/view/oracle-weblogic-server-new/,"Multi-choice test that measures the knowledge of the concepts of WebLogic such as server installation, administration, node, logs manager, security and deployment. Mid-Professional, Professional Individual Contributor, English (USA),",['Knowledge & Skills'],2,No,No
Organic Chemistry (New),https://www.shl.com/products/product-catalog/view/organic-chemistry-new/,"Multi-choice test that measures the knowledge of the basic concepts in organic chemistry. Graduate, Mid-Professional, Professional Individual Contributor, English (USA),",['Knowledge & Skills'],2,No,No
Paint Technology (New),https://www.shl.com/products/product-catalog/view/paint-technology-new/,"Multi-choice test that measures the knowledge of paint raw materials and precursors, manufacture of different types of coatings, surface treatment and coating applications. Professional Individual Contributor, Graduate, Mid-Professional, English (USA),",['Knowledge & Skills'],2,No,No
Pediatrics (New),https://www.shl.com/products/product-catalog/view/pediatrics-new/,"Multi-choice test that measures the basic knowledge of pediatric diseases, their symptoms and the medicines administered to cure or prevent them. Graduate, Mid-Professional, Professional Individual Contributor, English (USA),",['Knowledge & Skills'],2,No,No
Pega Development (New),https://www.shl.com/products/product-catalog/view/pega-development-new/,"Multi-choice test that measures the knowledge of Pega architecture, user interface, rule and user management, case management, integration with external systems, frameworks, applications and performance. Mid-Professional, Professional Individual Contributor, English (USA),",['Knowledge & Skills'],2,No,No
Perl (New),https://www.shl.com/products/product-catalog/view/perl-new/,"Multi-choice test that measures the knowledge of Perl scripting used for text manipulation, web development, system administration, etc. Mid-Professional, Professional Individual Contributor, English (USA),",['Knowledge & Skills'],2,No,No
Petrochemical Engineering (New),https://www.shl.com/products/product-catalog/view/petrochemical-engineering-new/,"Multi-choice test that measures the knowledge of fluid and thermal principles of petrochemical engineering, chemical processes, petroleum composition and processing. Graduate, Mid-Professional, Professional Individual Contributor, English (USA),",['Knowledge & Skills'],2,No,No
Petroleum Engineering (New),https://www.shl.com/products/product-catalog/view/petroleum-engineering-new/,"Multi-choice test that measures the knowledge of petroleum engineering, drilling and production operations and offshore petroleum production. Graduate, Mid-Professional, Professional Individual Contributor, English (USA),",['Knowledge & Skills'],2,No,No
Pharmaceutical Analysis (New),https://www.shl.com/products/product-catalog/view/pharmaceutical-analysis-new/,"Multi-choice test that measures the knowledge of laboratory analytical techniques such as chromatography, titration, spectroscopy, and spectrophotometry. Graduate, Mid-Professional, Professional Individual Contributor, English (USA),",['Knowledge & Skills'],2,No,No
Pharmaceutical Chemistry (New),https://www.shl.com/products/product-catalog/view/pharmaceutical-chemistry-new/,"Multi-choice test that measures the knowledge of physical chemistry, organic chemistry, inorganic chemistry, biochemistry and medicinal chemistry. Graduate, Mid-Professional, Professional Individual Contributor, English (USA),",['Knowledge & Skills'],2,No,No
Pharmaceutical Science (New),https://www.shl.com/products/product-catalog/view/pharmaceutical-science-new/,"Multi-choice test that measures the knowledge of drug manufacture, drug delivery, drug action, and pharmaceutical analysis techniques. Graduate, Mid-Professional, Professional Individual Contributor, English (USA),",['Knowledge & Skills'],2,No,No
Pharmaceutics (New),https://www.shl.com/products/product-catalog/view/pharmaceutics-new/,"Multi-choice test that measures the knowledge of pharmaceutical engineering and technology for drug manufacture, biopharmaceutics, modern pharmaceutics and dispensing pharmacy. Graduate, Mid-Professional, Professional Individual Contributor, English (USA),",['Knowledge & Skills'],2,No,No
Pharmacology (New),https://www.shl.com/products/product-catalog/view/pharmacology-new/,"Multi-choice test that measures the knowledge of pharmacological drugs classification, chemotherapy, inflammatory disorders, drug action on nervous system, endocrine pharmacology, drug action on circulatory system and GI tract. Graduate, Mid-Professional, Professional Individual Contributor, English (USA),",['Knowledge & Skills'],2,No,No
PHP (New),https://www.shl.com/products/product-catalog/view/php-new/,"Multi-choice test that measures the knowledge of OOPs & programming constructs, web & database handling and advanced PHP. Mid-Professional, Professional Individual Contributor, English (USA),",['Knowledge & Skills'],2,No,No
PJM Development Report,https://www.shl.com/products/product-catalog/view/pjm-development-report/,"The Person-Job Match Report is unique in that it
matches the performance potential of the
individual to the job’s specific competencies. This
provides you with a comprehensive and insightful
understanding of person-job fit.  The PJM Development report is written to support competency focused development of an individual.

In a development context, this report can be used: To identify specific areas of strength and weakness that may impact on the individual?s 
performance.As the basis for identif","['Competencies', 'Ability & Aptitude', 'Personality & Behavior']",2,No,No
PJM Selection Report,https://www.shl.com/products/product-catalog/view/pjm-selection-report/,"The PJM Report provides a clear indication of each candidate's ""degree of fit"" to a role.  Provides targeted assessment results that match individuals with jobs . Links the essential/desirable competencies for a specific job with an individual’s competency potential. Provides an overall Match (or fit) Score useful in ranking/sorting candidates for selection 
and/or development (e.g. Talent Audit).  It provides a highly visual profile of a candidate's strengths and limitations against identified ","['Ability & Aptitude', 'Competencies', 'Personality & Behavior']",2,No,No
Polymer Engineering (New),https://www.shl.com/products/product-catalog/view/polymer-engineering-new/,"Multi-choice test that measures the knowledge of characterization of polymers, processing, synthesis, testing and applications in daily life. Professional Individual Contributor, Graduate, Mid-Professional, English (USA),",['Knowledge & Skills'],2,No,No
Power Electronics and Drives (New),https://www.shl.com/products/product-catalog/view/power-electronics-and-drives-new/,"Multi-choice test that measures the knowledge of power semiconductor devices, power electronic converters, drives and control systems. Mid-Professional, Professional Individual Contributor, Graduate, English (USA),",['Knowledge & Skills'],2,No,No
Power System Engineering (New),https://www.shl.com/products/product-catalog/view/power-system-engineering-new/,"Multi-choice test that measures the knowledge of power generation and transmission, electrical machines, power systems and drives, control and instrumentation, fluid mechanics and machines. Graduate, Mid-Professional, Professional Individual Contributor, English (USA),",['Knowledge & Skills'],2,No,No
Prism (New),https://www.shl.com/products/product-catalog/view/prism-new/,"Multi-choice test that measures the knowledge of modules, patterns and other basic concepts of using the Prism library. Mid-Professional, Professional Individual Contributor, English (USA),",['Knowledge & Skills'],2,No,No
Production and Industrial Engineering (New),https://www.shl.com/products/product-catalog/view/production-and-industrial-engineering-new/,"Multi-choice test that measures the knowledge of production technology, quality management, and design and planning of manufacturing systems. Graduate, Mid-Professional, Professional Individual Contributor, English (USA),",['Knowledge & Skills'],2,No,No
Production Engineering (New),https://www.shl.com/products/product-catalog/view/production-engineering-new/,"Multi-choice test that measures the knowledge of production technology and analysis, metal cutting, tool design, material science and CIM. Graduate, Mid-Professional, Professional Individual Contributor, English (USA),",['Knowledge & Skills'],2,No,No
Programming Concepts,https://www.shl.com/products/product-catalog/view/programming-concepts/,"The Programming Concepts test measures knowledge of the core aspects of computer science programming that is valid across programming languages. Designed for all programmers, this test covers the following topics:  Algorithms, Complex Data Types, Data Access, Productivity and Quality, Program Flow, Program Structure, Programming Paradigms, User Interface, Variables, Data Types, and Operators. Mid-Professional, Professional Individual Contributor, English (USA),",['Knowledge & Skills'],2,No,No
Project Management (2013),https://www.shl.com/products/product-catalog/view/project-management-2013/,"The Project Management (2013) test measures knowledge of how to manage projects to ensure that objectives are completed on time and within budget. The test is based on Project Management Institute's (PMI's), Project Management Body of Knowledge (PMBOK) Fifth Edition methodology. Designed for all professionals, this test covers the following topics: Project Communications Management, Project Cost Management, Project Human Resource Management, Project Management Characteristics, Project Management",['Knowledge & Skills'],2,No,No
Proofreading v1,https://www.shl.com/products/product-catalog/view/proofreading-v1/,"This assessment measures ability to read for errors involving spelling, punctuation, grammar and word choice.  It also measures ability to correct those errors. Entry-Level, Mid-Professional, English International, English (USA),",['Knowledge & Skills'],2,No,No
Python (New),https://www.shl.com/products/product-catalog/view/python-new/,"Multi-choice test that measures the knowledge of Python programming, databases, modules and library. Mid-Professional, Professional Individual Contributor, English (USA),",['Knowledge & Skills'],2,No,No
R Programming (New),https://www.shl.com/products/product-catalog/view/r-programming-new/,"Multi-choice test that measures the knowledge of R programming and its application in statistics. Mid-Professional, Professional Individual Contributor, English (USA),",['Knowledge & Skills'],2,No,No
ReactJS (New),https://www.shl.com/products/product-catalog/view/reactjs-new/,"Multi-choice test that measures the technical knowledge of React APIs, render function, JSX, form validation and styling. Mid-Professional, Professional Individual Contributor, English (USA),",['Knowledge & Skills'],2,No,No
Reading Comprehension - English v1,https://www.shl.com/products/product-catalog/view/reading-comprehension-english-v1/,"The Reading Comprehension - English 
assessment provides a general measure of 
English reading comprehension. This test is 
comprised of items that contain a passage 
that you must read in order to answer the 
question being asked. The questions focus 
on the candidate's ability to demonstrate an 
understanding of the passage. Questions 
may be specific in nature, with answers that 
can be found almost word for word in the 
passage.  For example, the question may ask 
for a date, name or place t",['Ability & Aptitude'],2,No,No
Reading Comprehension - Spanish v1,https://www.shl.com/products/product-catalog/view/reading-comprehension-spanish-v1/,"The Reading Comprehension - Spanish assessment provides a general measure of Spanish reading comprehension. This test is comprised of items that contain a passage that must read in order to answer the question being asked. The questions focus on the ability to demonstrate an understanding of the passage. Questions may be specific in nature, with answers that can be found almost word for word in the passage. For example, the question may ask for a date, name or place that can be found by closely ",['Ability & Aptitude'],2,No,No
Reading Comprehension v2,https://www.shl.com/products/product-catalog/view/reading-comprehension-v2/,"The Reading Comprehension - English 
assessment provides a general measure of 
English reading comprehension. This test is 
comprised of items that contain a passage 
that you must read in order to answer the 
question being asked. The questions focus 
on the candidate's ability to demonstrate an 
understanding of the passage. Questions 
may be specific in nature, with answers that 
can be found almost word for word in the 
passage.  For example, the question may ask 
for a date, name or place t",['Ability & Aptitude'],2,No,No
RemoteWorkQ,https://www.shl.com/products/product-catalog/view/remoteworkq/,,['Competencies'],15,No,No
