name,url,description,test_type,duration,remote_testing,adaptive
Filing - Names (R1),https://www.shl.com/products/product-catalog/view/filing-names-r1/,"This test measures ability to sort names in alphabetical order. Test takers are shown a graphical display of four folder tabs -- three contain alphabetized names and one is blank. The test taker is required to select the name from a list that belongs on the blank tab. Entry-Level, English (USA),",['Knowledge & Skills'],2,No,No
Filing - Numbers,https://www.shl.com/products/product-catalog/view/filing-numbers/,"This test measures ability to sort items in numerical order. Test takers are shown a graphical display of four folder tabs -- three contain numbers and one is blank, and all are sorted in numeric order. The test taker is required to select the number from a list that belongs on the blank tab. Entry-Level, English (USA),",['Knowledge & Skills'],2,No,No
Financial Accounting (New),https://www.shl.com/products/product-catalog/view/financial-accounting-new/,"Multi-choice test that measures the ability to post journal entries, classify items into assets and liabilities, analyze financial statements and calculate financial ratios. Entry-Level, Graduate, Manager, Mid-Professional, Professional Individual Contributor, Supervisor, English (USA),",['Knowledge & Skills'],2,No,No
Financial and Banking Services (New),https://www.shl.com/products/product-catalog/view/financial-and-banking-services-new/,"Multi-choice test that measures the knowledge of investment products, banking products, taxation and principles of Macroeconomics. Graduate, Manager, Mid-Professional, Professional Individual Contributor, Supervisor, English (USA),",['Knowledge & Skills'],2,No,No
Fire Engineering (New),https://www.shl.com/products/product-catalog/view/fire-engineering-new/,"Multi-choice test that measures the knowledge of fire engineering principles, basic workplace safety and safety management. Graduate, Mid-Professional, Professional Individual Contributor, English (USA),",['Knowledge & Skills'],2,No,No
Following Instructions v1 - UK (R1),https://www.shl.com/products/product-catalog/view/following-instructions-v1-uk-r1/,"This test measures a candidate's ability to follow detailed instructions and then select the correct course of action. Candidates are presented with a set of rules and need to choose the appropriate response for various situations based on the rules given. Entry-Level, Front Line Manager, Mid-Professional, Professional Individual Contributor, English International,",['Knowledge & Skills'],2,No,No
Following Instructions v1 - US (R2),https://www.shl.com/products/product-catalog/view/following-instructions-v1-us-r2/,"This test measures a candidate's ability to follow detailed instructions and then select the correct course of action. Test takers are presented with a set of rules and need to choose the appropriate response for various situations based on the rules given. Entry-Level, Front Line Manager, Mid-Professional, Professional Individual Contributor, English (USA),",['Knowledge & Skills'],2,No,No
Food and Beverage Services (New),https://www.shl.com/products/product-catalog/view/food-and-beverage-services-new/,"Multi-choice test that measures the knowledge of meal planning, service preparation, types of service equipment, and types of beverages. Graduate, Manager, Mid-Professional, Professional Individual Contributor, Supervisor, English (USA),",['Knowledge & Skills'],2,No,No
Food Science (New),https://www.shl.com/products/product-catalog/view/food-science-new/,"Multi-choice test that measures the knowledge of food chemistry, nutrition, food microbiology, food engineering and food product technology. Graduate, Mid-Professional, Professional Individual Contributor, English (USA),",['Knowledge & Skills'],2,No,No
Front Office Management (New),https://www.shl.com/products/product-catalog/view/front-office-management-new/,"Multi-choice test that measures the knowledge of front office operations. Entry-Level, Graduate, Mid-Professional, Professional Individual Contributor, English (USA),",['Knowledge & Skills'],2,No,No
Fundamentals of Chemistry (New),https://www.shl.com/products/product-catalog/view/fundamentals-of-chemistry-new/,"Multi-choice test that measures the knowledge of physical chemistry, inorganic chemistry and organic chemistry. Graduate, Mid-Professional, Professional Individual Contributor, English (USA),",['Knowledge & Skills'],2,No,No
Fundamentals of Physics (New),https://www.shl.com/products/product-catalog/view/fundamentals-of-physics-new/,"Multi-choice test that measures the knowledge of classical mechanics, Newton's laws of motion, electromagnetism, EM waves, thermodynamics and modern physics. Graduate, Mid-Professional, Professional Individual Contributor, English (USA),",['Knowledge & Skills'],2,No,No
General Diseases (New),https://www.shl.com/products/product-catalog/view/general-diseases-new/,"Multi-choice test that measures the knowledge of common diseases of ear, nose, throat and teeth, their symptoms, drugs used to treat them and various drugs used to relieve pain. Graduate, Mid-Professional, Professional Individual Contributor, English (USA),",['Knowledge & Skills'],2,No,No
Geoinformatics Engineering (New),https://www.shl.com/products/product-catalog/view/geoinformatics-engineering-new/,"Multi-choice test that measures the knowledge of remote sensing, digital image processing, digital photogrammetry, planning and surveying, geology, GIS and drilling Engineering. Mid-Professional, Professional Individual Contributor, Supervisor, Entry-Level, Graduate, English (USA),",['Knowledge & Skills'],2,No,No
Geoscience Engineering (New),https://www.shl.com/products/product-catalog/view/geoscience-engineering-new/,"Multi-choice test that measures the knowledge of exploration geology, soil mechanics, rock mechanics, geophysical investigation, geological surveying. Mid-Professional, Professional Individual Contributor, Graduate, English (USA),",['Knowledge & Skills'],2,No,No
GIT (New),https://www.shl.com/products/product-catalog/view/git-new/,"Multi-choice test that measures the knowledge of how to use GIT for version control. Mid-Professional, Professional Individual Contributor, English (USA),",['Knowledge & Skills'],2,No,No
Global Skills Assessment,https://www.shl.com/products/product-catalog/view/global-skills-assessment/,"The Global Skills Assessment (GSA) is an assessment used to measure 96 discrete skills/behaviors. These 96 skill scores are directly aligned to the most discrete level of SHL’s Universal Competency Framework (UCF). The GSA measures self-reported behaviors an individual currently engages in. A person’s skills (sets of behavior) are malleable and may change over time. SHL utilizes GSA scores to understand what the participant reports they can do today. Indonesian, Italian, Swedish, Thai, Portugues","['Competencies', 'Knowledge & Skills']",2,No,No
Graduate Scenarios,https://www.shl.com/products/product-catalog/view/graduate-scenarios/,"Graduate Scenarios is a unique test of Managerial Judgement - an individual’s ability to decide on effective ways of handling real life situations. It is specifically designed to assess judgement in graduates; a group who typically has limited work experience to draw on. It consists of hypothetical scenarios, each followed by several possible responses. Candidates rate the effectiveness of each response, using a 6-point scale, from highly undesirable to highly desirable. It can be used for recru",['Biodata & Situational Judgement'],2,No,No
Graduate Scenarios Narrative Report,https://www.shl.com/products/product-catalog/view/graduate-scenarios-narrative-report/,"Graduate Scenarios is a unique test of Managerial Judgement - an individual’s ability to decide on effective ways of handling real life situations. It is specifically designed to assess judgement in graduates; a group who typically has limited work experience to draw on. It consists of hypothetical scenarios, each followed by several possible responses. Candidates rate the effectiveness of each response, using a 6-point scale, from highly undesirable to highly desirable. It can be used for recru",['Biodata & Situational Judgement'],2,No,No
Graduate Scenarios Profile Report,https://www.shl.com/products/product-catalog/view/graduate-scenarios-profile-report/,"Graduate Scenarios is a unique test of Managerial Judgement - an individual’s ability to decide on effective ways of handling real life situations. It is specifically designed to assess judgement in graduates; a group who typically has limited work experience to draw on. It consists of hypothetical scenarios, each followed by several possible responses. Candidates rate the effectiveness of each response, using a 6-point scale, from highly undesirable to highly desirable. It can be used for recru",['Biodata & Situational Judgement'],2,No,No
Hibernate (New),https://www.shl.com/products/product-catalog/view/hibernate-new/,"Multi-choice test that measures the knowledge of Hibernate architecture, Hibernate mapping and Hibernate query language(HQL). Mid-Professional, Professional Individual Contributor, English (USA),",['Knowledge & Skills'],2,No,No
HIPAA (Security),https://www.shl.com/products/product-catalog/view/hipaa-security/,"The HIPAA (Security) test measures knowledge of compliance with the standards required by the Security and Electronic Signature Standards as they apply to HIPAA. Designed for healthcare professionals and concentrating on nontechnical as well as technical aspects of the HIPAA Standards for Security and Electronic Signatures, this test covers the following topics: Computer Mechanisms, Computer Models, General Knowledge, Implementation, Medical Records, Organization, Security Basics, and Setup. Fro",['Knowledge & Skills'],2,No,No
HiPo Assessment Report 1.0,https://www.shl.com/products/product-catalog/view/hipo-assessment-report-1-0/,"Part of SHL’s High Potential solution and developed from SHL’s extensive research into high-potential programs, the HIPO Assessment Report 1.0 helps organizations identify individuals with the strongest potential to succeed in senior and challenging roles. Using assessments such as the Motivation Questionnaire, OPQ, and Verify Cognitive Ability Tests, the report evaluates critical areas of aspiration, ability, and engagement. This version is used in regions where normed data for Verify Gen 1 and","['Competencies', 'Personality & Behavior']",2,No,No
HiPo Assessment Report 2.0,https://www.shl.com/products/product-catalog/view/hipo-assessment-report-2-0/,"Part of SHL’s High Potential solution and developed from SHL’s extensive research into high-potential programs, the HIPO Assessment Report 2.0 helps organizations identify individuals with the strongest potential to succeed in senior and challenging roles. Using assessments such as the Motivation Questionnaire, OPQ, and Verify Cognitive Ability Tests, the report evaluates critical areas of aspiration, ability, and engagement. This report equips organizations with data-driven insights for identif","['Competencies', 'Personality & Behavior']",2,No,No
HiPo Unlocking Potential Report 2.0,https://www.shl.com/products/product-catalog/view/hipo-unlocking-potential-report-2-0/,"This report draws insights from the Occupational Personality QuestionnaireTM (OPQ32). Used for individuals who are selected into a client’s HiPo program, it provides a detailed analysis of managerial and leadership potential. Test Type:C Remote Testing:",['Competencies'],2,No,No
Housekeeping (New),https://www.shl.com/products/product-catalog/view/housekeeping-new/,"Multi-choice test that measures the knowledge of housekeeping activities such as cleaning, laundry, room maintenance and routine checks. Entry-Level, Front Line Manager, Supervisor, English (USA),",['Knowledge & Skills'],2,No,No
HTML/CSS (New),https://www.shl.com/products/product-catalog/view/htmlcss-new/,"Multi-choice test that measures the knowledge of HTML to create a user interface and CSS to stylize it. Mid-Professional, Professional Individual Contributor, English (USA),",['Knowledge & Skills'],2,No,No
HTML5 (New),https://www.shl.com/products/product-catalog/view/html5-new/,"Multi-choice test that measures the knowledge of HTML5 and its application in creating a user interface. Mid-Professional, Professional Individual Contributor, English (USA),",['Knowledge & Skills'],2,No,No
Human Resources (New),https://www.shl.com/products/product-catalog/view/human-resources-new/,,['Knowledge & Skills'],15,No,No
IBM DataStage (New),https://www.shl.com/products/product-catalog/view/ibm-datastage-new/,,['Knowledge & Skills'],15,No,No
IBM Sterling Order Management System (New),https://www.shl.com/products/product-catalog/view/ibm-sterling-order-management-system-new/,"Multi-choice test that measures the knowledge of the basic concepts of Sterling Order Management System installation, modeling, extensibility, inventory reservations, etc. Mid-Professional, Professional Individual Contributor, English (USA),",['Knowledge & Skills'],2,No,No
Industrial Engineering (New),https://www.shl.com/products/product-catalog/view/industrial-engineering-new/,"Multi-choice test that measures the conceptual knowledge of design, quality control, reliability, management and costing of manufacturing systems. Graduate, Mid-Professional, Professional Individual Contributor, English (USA),",['Knowledge & Skills'],2,No,No
Informatica (Architecture) (New),https://www.shl.com/products/product-catalog/view/informatica-architecture-new/,,['Knowledge & Skills'],15,No,No
Informatica (Developer) (New),https://www.shl.com/products/product-catalog/view/informatica-developer-new/,"Multi-choice test that measures the knowledge of data warehousing, server architecture and administration, and real time implementation with Informatica. Mid-Professional, Professional Individual Contributor, English (USA),",['Knowledge & Skills'],2,No,No
Instrumentation Engineering (New),https://www.shl.com/products/product-catalog/view/instrumentation-engineering-new/,"Multi-choice test that measures the conceptual knowledge of instrumentation, electronics, signals and communication systems. Graduate, Mid-Professional, Professional Individual Contributor, English (USA),",['Knowledge & Skills'],2,No,No
Interpersonal Communications,https://www.shl.com/products/product-catalog/view/interpersonal-communications/,"This adaptive test measures the candidate's knowledge of how to employ effective verbal and non-verbal communication to send his or her message and manage conflicts. It is designed for all professionals and covers the following topics: Communication and Perception, Group Communication and Teamwork, Intercultural Communication, Interpersonal Communication, Interviewing and Communication, Intrapersonal Communication, Listening, Nonverbal Communication, Technology in Communication, Verbal Communica",['Knowledge & Skills'],2,No,No
Interviewing and Hiring Concepts (U.S.),https://www.shl.com/products/product-catalog/view/interviewing-and-hiring-concepts-u-s/,"The Interviewing and Hiring Concepts (U.S.) test measures knowledge of the interviewing  and hiring process. Designed for all employees and hiring managers, this test covers the following topics: Behavior Traits, Behavioral Interviewing, Candidate Fit, Interview Quality Control, Job Analysis, Legal Compliance, Probing Skills, Screening, Situational Interviews, and Types of Interviews. Front Line Manager, Manager, English (USA),",['Knowledge & Skills'],2,No,No
iOS Development (New),https://www.shl.com/products/product-catalog/view/ios-development-new/,"Multi-choice test that measures the knowledge of Objective C, NSObject, iOS fundamentals and UI design on iOS phones. Mid-Professional, Professional Individual Contributor, English (USA),",['Knowledge & Skills'],2,No,No
ITIL (IT Infrastructure Library) (New),https://www.shl.com/products/product-catalog/view/itil-it-infrastructure-library-new/,"Multi-choice test that measures the knowledge of capacity management, change management and problem management. Manager, Mid-Professional, Professional Individual Contributor, Supervisor, English (USA),",['Knowledge & Skills'],2,No,No
Java 2 Platform Enterprise Edition 1.4 Fundamental,https://www.shl.com/products/product-catalog/view/java-2-platform-enterprise-edition-1-4-fundamental/,"The Java 2 Platform Enterprise Edition (J2EE) 1.4 Fundamentals test measures knowledge of basic J2EE 1.4 Fundamentals. Designed for entry-level users, this test covers the following topics: Business Component Development, J2EE 1.4 Architecture, JAX 1.2, JDBC 3.0, Supporting API, Web Component Development, and Web Service Development. Entry-Level, Mid-Professional, Professional Individual Contributor, English (USA),",['Knowledge & Skills'],2,No,No
Java 8 (New),https://www.shl.com/products/product-catalog/view/java-8-new/,"Multi-choice test that measures the knowledge of Java class design, exceptions, generics, collections, concurrency, JDBC and Java I/O fundamentals. Mid-Professional, Professional Individual Contributor, English (USA),",['Knowledge & Skills'],2,No,No
Java Design Patterns (New),https://www.shl.com/products/product-catalog/view/java-design-patterns-new/,"Multi-choice test that measures the knowledge of the types of design patterns in Java and principles like threads and refactoring used in Java design patterns. Mid-Professional, Professional Individual Contributor, English (USA),",['Knowledge & Skills'],2,No,No
Java Frameworks (New),https://www.shl.com/products/product-catalog/view/java-frameworks-new/,"Multi-choice test that measures the knowledge of different Java frameworks - Struts, Hibernate and Spring. Mid-Professional, Professional Individual Contributor, English (USA),",['Knowledge & Skills'],2,No,No
Java Platform Enterprise Edition 7 (Java EE 7),https://www.shl.com/products/product-catalog/view/java-platform-enterprise-edition-7-java-ee-7/,"The Java Platform Enterprise Edition 7 (Java EE 7) test measures knowledge of the Java EE 7 architecture. Designed for Java programmers and architects, this test includes the following topics: Commonly-Used APIs, Component Technology, Database Access, JEE Application Architecture, JSP Extensions, Resource Management, Web Services, Webapp Control and View Technologies, and Webapp Technology. Mid-Professional, Professional Individual Contributor, English (USA),",['Knowledge & Skills'],2,No,No
Java Web Services (New),https://www.shl.com/products/product-catalog/view/java-web-services-new/,"Multi-choice test that measures the knowledge of basic Java constructs, OOP concepts, file handling, exception handling, threads, generics and inner class. Mid-Professional, Professional Individual Contributor, English (USA),",['Knowledge & Skills'],2,No,No
JavaScript (New),https://www.shl.com/products/product-catalog/view/javascript-new/,"Multi-choice test that measures knowledge of programming in the JavaScript language and its application in front-end development. Mid-Professional, Professional Individual Contributor, English (USA),",['Knowledge & Skills'],2,No,No
Jenkins (New),https://www.shl.com/products/product-catalog/view/jenkins-new/,"Multi-choice test that measures the knowledge of Jenkins configuration and deployment, plugins, nodes, build jobs and testing. Mid-Professional, Professional Individual Contributor, English (USA),",['Knowledge & Skills'],2,No,No
Job Control Language (New),https://www.shl.com/products/product-catalog/view/job-control-language-new/,"Multi-choice test that measures the knowledge of JCL libraries, parameters, statements, datasets, generation of data groups and conditional processing. Mid-Professional, Professional Individual Contributor, English (USA),",['Knowledge & Skills'],2,No,No
jQuery (New),https://www.shl.com/products/product-catalog/view/jquery-new/,"Multi-choice test that measures the knowledge of jQuery events and effects, jQuery animation, UI, references, and using jQuery with AJAX. Mid-Professional, Professional Individual Contributor, English (USA),",['Knowledge & Skills'],2,No,No
Kubernetes (New),https://www.shl.com/products/product-catalog/view/kubernetes-new/,"Multi-choice test that measures the knowledge of the architecture, cluster and services of Kubernetes. Mid-Professional, Professional Individual Contributor, English (USA),",['Knowledge & Skills'],2,No,No
Linux Administration (New),https://www.shl.com/products/product-catalog/view/linux-administration-new/,"Multi-choice test that measures knowledge of the Linux operating system and its application in system administration and network administration. Mid-Professional, Professional Individual Contributor, English (USA),",['Knowledge & Skills'],2,No,No
Linux Operating System,https://www.shl.com/products/product-catalog/view/linux-operating-system/,"Multi-choice test that measures the knowledge of Linux system, command line, filesystem, memory management, and process management. Entry-Level, General Population, Graduate, Professional Individual Contributor, English (USA),",['Knowledge & Skills'],2,No,No
Linux Programming (General),https://www.shl.com/products/product-catalog/view/linux-programming-general/,"The Linux Programming (General) test measures knowledge of programming in a Linux environment. Designed for experienced programmers, this test covers the following topics: AutoConf/AutoMake, Makefiles, C Programming, C++, Debugging Programs, Linux Programming Concepts, Platform Independence, Revision Control, RPC/CORBA, and X Programming. Mid-Professional, Professional Individual Contributor, English (USA),",['Knowledge & Skills'],2,No,No
Load Runner (New),https://www.shl.com/products/product-catalog/view/load-runner-new/,"Multi-choice test that measures the knowledge on the concepts of Load Runner architecture & installation, virtual user generator (VUGEN), controller, monitoring scenario and result analysis. Mid-Professional, Professional Individual Contributor, English (USA),",['Knowledge & Skills'],2,No,No
Management Scenarios,https://www.shl.com/products/product-catalog/view/management-scenarios/,"Managerial Scenarios is a unique test of Managerial Judgement - an individual’s ability to decide on effective ways of handling real life situations. It consists of hypothetical scenarios, each followed by several possible responses. Candidates rate the effectiveness of each response, using a 6-point scale, from highly undesirable to highly desirable. It can be used for recruitment, selection, training and development, performance management and coaching in a variety of functions and industries.",['Biodata & Situational Judgement'],2,No,No
Managerial Scenarios Candidate Report,https://www.shl.com/products/product-catalog/view/managerial-scenarios-candidate-report/,"Managerial Scenarios is a unique test of Managerial Judgement - an individual’s ability to decide on effective ways of handling real life situations. It consists of hypothetical scenarios, each followed by several possible responses. Candidates rate the effectiveness of each response, using a 6-point scale, from highly undesirable to highly desirable. It can be used for recruitment, selection, training and development, performance management and coaching in a variety of functions and industries.",['Biodata & Situational Judgement'],2,No,No
Managerial Scenarios Narrative Report,https://www.shl.com/products/product-catalog/view/managerial-scenarios-narrative-report/,"Managerial Scenarios is a unique test of Managerial Judgement - an individual’s ability to decide on effective ways of handling real life situations. It consists of hypothetical scenarios, each followed by several possible responses. Candidates rate the effectiveness of each response, using a 6-point scale, from highly undesirable to highly desirable. It can be used for recruitment, selection, training and development, performance management and coaching in a variety of functions and industries.",['Biodata & Situational Judgement'],2,No,No
Managerial Scenarios Profile Report,https://www.shl.com/products/product-catalog/view/managerial-scenarios-profile-report/,"Managerial Scenarios is a unique test of Managerial Judgement - an individual’s ability to decide on effective ways of handling real life situations. It consists of hypothetical scenarios, each followed by several possible responses. Candidates rate the effectiveness of each response, using a 6-point scale, from highly undesirable to highly desirable. It can be used for recruitment, selection, training and development, performance management and coaching in a variety of functions and industries.",['Biodata & Situational Judgement'],2,No,No
Manual Testing (New),https://www.shl.com/products/product-catalog/view/manual-testing-new/,"Multi-choice test that measures the knowledge of the software testing life cycle, testing tools and techniques, design of test cases and generation of test reports. Mid-Professional, Professional Individual Contributor, English (USA),",['Knowledge & Skills'],2,No,No
Manufac. & Indust. - Mechanical & Vigilance 8.0,https://www.shl.com/products/product-catalog/view/mechanical-and-vigilance-focus-8-0/,"The Manufacturing & Industrial Mechanical & Vigilance Focus 8.0 Job-Focused Assessment 
measures the behaviors that underlie successful and safe performance in an 
industrial/manufacturing setting. This solution assesses process monitoring, mechanical 
comprehension and other foundational behaviors including behaving safely in the workplace; 
applying domain-related expertise; offering practical solutions; and attending to multiple tasks.
Potential job titles that use this solution include: Mach","['Ability & Aptitude', 'Personality & Behavior']",2,No,No
